topic,gamma,terms,FREX,LIFT,SCORE,prob,max_DOI,title,abstract,label
18,0.028101202,"firm, effect, innovation, evidence, activity, result, csr, increase, finding, labor","csr, innovation, trade credit, crash risk, supplier, patent, firm, labor, corporate social responsibility, product market","unionization, corporate social responsibility, csr, patent, crash risk, corporate innovation, product market, trade credit, product market competition, tech","unionization, firm, csr, innovation, trade credit, crash risk, patent, labor, supplier, corporate social responsibility","firm, effect, innovation, evidence, activity, result, csr, increase, finding, labor",10.1017/S0022109017000540,What Affects Innovation More: Policy or Policy Uncertainty?,"Motivated by a theoretical model, we examine for 43 countries whether it is policy or policy uncertainty that affects technological innovation more. Innovation activities, measured by patent-based proxies, are not, on average, affected by which policy is in place. Innovation activities, however, drop significantly during times of policy uncertainty measured by national elections. The drop is greater for more influential innovations (citations in the right tail, exploratory rather than exploitative innovations) and for innovation-intensive industries. We use close presidential elections and ethnic fractionalization to address endogeneity concerns. We uncover the mechanism underlying the main result by showing that the number of patenting inventors decreases with policy uncertainty. Political compromise, we conclude, encourages innovation.  Copyright Michael G. Foster School of Business, University of Washington 2017.",Corporate Social Responsability
19,0.011258376,"government, author, financial, study, behalf, right, authors, society, state, enterprise","behalf, government, society, internet, authors, financial, permission, enterprise, soes, corruption","visit, appendix, permission, behalf, internet, web, soes, society, editor, authors","visit, government, behalf, society, financial, author, internet, authors, corruption, enterprise","government, author, financial, study, behalf, right, authors, society, state, enterprise",10.1016/j.pacfin.2018.05.003,Political connections and firm performance: Evidence from government officials' site visits,"This study uses government officials' corporate site visits as a measurement of political connection and examines how political connection affects firm performance. Using a novel dataset on government officials' site visits from 2004 to 2014, we find that firm performance increases following corporate site visits by government officials. This study finds that firms obtain more new investment projects and bank loans, improve corporate governance, and decrease information asymmetry as well. Government officials' site visits are also associated with positive abnormal stock returns, indicating that investors interpret government officials' site visits as a signal of government endorsement and support. Using China's recent anti-corruption campaign as an exogenous shock, we find that political connections are more valuable in the absence of political corruption.  2018 Elsevier B.V.",Political Relationship/Corruption
20,0.013050126,"efficiency, technology, production, productivity, cost, stage, scale, revenue, inefficiency, performance","efficiency, technology, inefficiency, revenue, productivity, production, scale, stage, credit union, scope","credit union, data envelopment analysis, dea, cost efficiency, profit efficiency, bank efficiency, inefficiency, efficiency, productivity growth, scope","credit union, efficiency, productivity, technology, production, inefficiency, revenue, scale, cost efficiency, consolidation","efficiency, technology, production, productivity, cost, stage, scale, revenue, inefficiency, performance",10.1016/j.jbankfin.2003.10.014,Productivity change in European banking: A comparison of parametric and non-parametric approaches,"This paper compares parametric and non-parametric estimates of productivity change in European banking between 1994 and 2000. Productivity change has also been further decomposed into technological change, or change in best practice, and efficiency change. Both the parametric and non-parametric approaches consistently identify those systems that have benefited most (and least) from productivity change during the 1990s. The results also suggest that (where found) productivity growth has mainly been brought about by improvements in technological change and there does not appear to have been 'catch-up' by non-best-practice institutions. Competing methodologies sometimes identify conflicting findings for the sources of productivity for individual years. However, the two approaches generally do not yield markedly different results in terms of identifying the components of productivity growth in European banking during the 1990s.  2003 Elsevier B.V. All rights reserved.",Banking Efficiency
21,0.016706667,"shareholder, ownership, control, insider, manager, class, ownership structure, management, owner, insider trading","insider, voting, ownership, vote, proposal, control, insider trade, blockholder, shareholder, insider trading","pill, voting, vote, voting rights, activism, activist, insider, insider trade, large shareholder, insiders","pill, shareholder, ownership, insider, control, voting, insider trading, ownership structure, blockholder, control shareholder","shareholder, ownership, control, insider, manager, class, ownership structure, management, owner, insider trading",10.1111/j.1540-6261.2011.01682.x,Nonbinding Voting for Shareholder Proposals,"Shareholder proposals are a common form of shareholder activism. Voting for shareholder proposals, however, is nonbinding since management has the authority to reject the proposal even if it received majority support from shareholders. We analyze whether nonbinding voting is an effective mechanism for conveying shareholder expectations. We show that, unlike binding voting, nonbinding voting generally fails to convey shareholder views when manager and shareholder interests are not aligned. Surprisingly, the presence of an activist investor who can discipline the manager may enhance the advisory role of nonbinding voting only if conflicts of interest between shareholders and the activist are substantial.  2011 the American Finance Association.",Ownership
22,0.024779305,"country, institution, world, level, cross, region, determinant, difference, growth, factor","institution, islamic, economic growth, culture, country, financial development, region, trust, world, cross country","mfis, microfinance, mena, stock market development, individualism, globalization, host, culture, financial development, economic development","mfis, country, institution, islamic, financial development, region, economic growth, culture, world, trust","country, institution, world, level, cross, region, determinant, difference, growth, factor",10.1016/j.frl.2019.101310,Trust and financial inclusion: A cross-country study,"This study examines the role of social trust in financial inclusion around the world, using financial inclusion measures from Global Findex database and measure of trust from the World Values Survey. After controlling for individual characteristics, and country level differences in institutions and financial markets, social trust remains a significant and positive determinant for various aspects of financial inclusion. Trust is further found to supplement weak formal institutions and low educational levels. The role of limited trust is also examined in the study.  2019 Elsevier Inc.",Emerging Country
23,0.011511027,"equity, share, valuation, book, equity market, market value, percent, size, listing, equity return","equity, market value, book, listing, share, share market, adrs, out, book value, market ratio","carve, share market, depositary, equity, adrs, receipts, adr, book value, market value, market ratio","carve, equity, share, book, valuation, listing, market value, equity market, percent, adrs","equity, share, valuation, book, equity market, market value, percent, size, listing, equity return",10.1016/j.intfin.2018.11.014,ADR valuation and listing of foreign firms in U.S. Equity markets,We examine the decision to list in the U.S. markets by foreign firms through American Depository Receipts (ADRs). There is a high positive correlation between the valuation of existing ADRs and the number of new ADR listings next year. ADR listing is more likely when existing ADRs are valued higher. The subsequent operating and stock performance of ADR firms listed in hot years is significantly worse than those of ADR firms listed in cold years. These results are consistent with the hypothesis that market timing is an important motivation for foreign firms to list in the U.S. equity markets.  2018 Elsevier B.V.,Firm Valuation
24,0.015577686,"cost, demand, product, payment, money, service, consumer, transaction, retail, reserve","product, demand, retail, service, settlement, payment, elasticity, consumer, money, usage","debit, card, retailer, brand, settlement, retail, check, service, product, elasticity","debit, demand, payment, cost, product, consumer, service, money, retail, settlement","cost, demand, product, payment, money, service, consumer, transaction, retail, reserve",10.1016/j.jbankfin.2009.09.008,Incentives at the counter: An empirical analysis of surcharging card payments and payment behaviour in the Netherlands,"In card payment systems, no-surcharge rules prohibit merchants from charging consumers extra for card payments. However, such rules are prohibited in the Netherlands. Dutch retailers are allowed to surcharge consumers for debit card use. This setting permits an empirical analysis of the impact of surcharging card payments on merchant acceptance and consumer payment choice. Based on consumer and retailer survey data, our analysis shows that surcharging steers consumers away from using debit cards towards cash. Half of the observed difference in debit card payment shares across retailers can be explained by this surcharge effect. Removing debit card surcharges may induce cost savings of more than EUR 50 million in the long run.  2009 Elsevier B.V.",Retail Payment System
25,0.01346962,"bond, spread, yield, cds, bond market, corporate bond, call, credit spread, credit default swap, government bond","bond, cds, corporate bond, bond market, yield spread, bond return, credit default swap, grade, credit spread, bond yield","coco, bond spread, corporate bond, junk, corporate bond market, cds, bond, bonds, yield spread, cds spread","coco, bond, spread, cds, corporate bond, yield, bond market, credit default swap, credit spread, bond return","bond, spread, yield, cds, bond market, corporate bond, call, credit spread, credit default swap, government bond",10.1016/j.pacfin.2019.06.006,Measuring the liquidity impact on catastrophe bond spreads,"This study measures liquidity in the catastrophe (CAT) bond market and the liquidity premium embedded in CAT bond spreads. The empirical results show that time to maturity, yield volatility, and yield dispersion from the primary market are the three most effective liquidity proxies. Given these three proxies, the average estimated liquidity premium in the CAT bond market is 67.57bps, accounting for only 9.42% of the average CAT bond spread (717.37bps) in the secondary market during the period 2002-2016. The average CAT bond liquidity premium is higher than the corporate bond liquidity premium of a similar risk class by about 35bps during the pre-crisis period. The more significant part of the high-yield spreads, 90.58%, is attributed to other risk natures of CAT bonds. Lastly, the liquidity premium increases dramatically after occurrences of severe natural catastrophes as well as during the 2008 financial crisis.  2019",Bond Market
26,0.031476151,"return, effect, period, day, stock return, pattern, month, evidence, result, year","day, week, january, month, pattern, lag, december, return, seasonality, feedback","weekend, monday, holiday, week, friday, seasonality, calendar, january, december, tom","weekend, return, day, stock return, effect, month, january, week, autocorrelation, seasonality","return, effect, period, day, stock return, pattern, month, evidence, result, year",10.1111/j.1540-6288.1999.tb00474.x,"Day-of-the-week autocorrelations, cross-autocorrelations, and the weekend phenomenon","This study examines whether autocorrelations or cross-autocorrelations are more closely associated with the weekend phenomenon. Our results show a significant day-of-the-week pattern in autocorrelations associated with the weekend phenomenon. However, we find no marginal influence of a day-of-the-week pattern in cross-autocorrelations on the weekend phenomenon.  1999 Blackwell Publishing Ltd.",Market Anomaly
27,0.011497457,"exposure, hedge, commodity, hedging, bitcoin, energy, gold, cryptocurrency, market risk, ambiguity","bitcoin, cryptocurrency, ambiguity, energy, carbon, tail risk, gold, hedge, climate, commodity","carbon, emission, climate, ambiguity, bitcoin, cryptocurrency, cryptocurrency market, downside, safe haven, tail risk","carbon, commodity, hedge, bitcoin, hedging, exposure, cryptocurrency, energy, gold, tail risk","exposure, hedge, commodity, hedging, bitcoin, energy, gold, cryptocurrency, market risk, ambiguity",10.1016/j.frl.2019.08.001,Diamonds versus precious metals: What gleams most against USD exchange rates?,"Historically, commodity market, particularly the metal market has been used as a hedge for stock market and currencies during time of distress. In this paper, we shed light on a new alternative asset and examine the hedging and safe haven ability of diamonds and five precious metals that is, gold, silver, palladium, platinum and rhodium by using copula process. Then, we compare the performance of diamond versus metals in terms of hedging and safe haven against USD depreciation. Our empirical results show that gold, silver, palladium and platinum outperform diamonds and rhodium in term of hedging against USD movement. Our finding for safe haven study reveals that both precious metals and diamonds serve as a weak safe haven.  2019 Elsevier Inc.",Hedging
28,0.023576373,"currency, ltd, exchange rate, dollar, paper, country, intervention, trade, right, effect","currency, exchange rate, dollar, capital flow, emu, ltd, foreign currency, current account, export, exchange rate volatility","dollarization, renminbi, currency crisis, capital account, devaluation, exchange rate volatility, franc, ems, currency, capital control","dollarization, exchange rate, currency, ltd, dollar, current account, intervention, real exchange rate, country, foreign exchange","currency, ltd, exchange rate, dollar, paper, country, intervention, trade, right, effect",10.1016/j.jimonfin.2019.102104,Currency composition of foreign exchange reserves,"This paper analyses the factors that govern the choice of the currency composition of official foreign exchange reserves. First, we introduce a new panel dataset on the key currencies in foreign exchange reserves of about 60 economies in the 19992017 period. Second, we show that the currency composition of reserves relates strongly to the co-movement of the domestic currency with key currencies and the currency invoicing of trade. These factors represent attributes of the dollar or the euro rather than of the United States or the euro area. They exert about equal effects on the currency composition of foreign exchange reserves. We demonstrate that these findings are robust to a host of other possible factors.  2019 Elsevier Ltd",Currency
29,0.014563079,"rate, default, mortgage, model, credit risk, probability, duration, default risk, time, recovery","default, prepayment, mortgage, default probability, rate, pool, duration, recovery rate, recovery, foreclosure","prepayment, cdos, hazard model, cdo, mortgage default, default probability, cmb, foreclosure, recovery rate, commercial mortgage","prepayment, mortgage, rate, default, credit risk, default risk, duration, default probability, recovery rate, foreclosure","rate, default, mortgage, model, credit risk, probability, duration, default risk, time, recovery",10.1111/j.1475-6803.1993.tb00122.x,PREPAYMENT RISK AND THE DURATION OF DEFAULT-FREE MORTGAGE-BACKED SECURITIES,"The conventional duration measure for mortgage-backed pass-through securities assumes that the prepayment rate is invariant to changes in market interest rates. In this paper, the conventional duration is modified to take into account the interest-rate sensitivity of mortgage prepayments. Including interest rate sensitivity is shown to reduce substantially the duration of a mortgage-backed pass-through security when the current mortgage rate is less than the contract rate.  The Southern Finance Association and the Southwestern Finance Association",Credit Risk
30,0.02508345,"stock market, crisis, correlation, period, financial crisis, spillover, contagion, financial market, oil, time","spillover, contagion, linkage, oil price, covid, oil, causality, crisis, spillover effect, connectedness","terrorist, brexit, outbreak, oil price, pandemic, covid, oil market, oil price shocks, connectedness, spillover","terrorist, crisis, stock market, contagion, oil, spillover, correlation, oil price, volatility spillover, covid","stock market, crisis, correlation, period, financial crisis, spillover, contagion, financial market, oil, time",10.1016/j.irfa.2018.11.007,Dependences and volatility spillovers between the oil and stock markets: New evidence from the copula and VAR-BEKK-GARCH models,"This paper examines the dynamic relationship between the oil market and stock markets from two perspectives: dependence between the crude oil market (WTI) and stock markets of the US and China, and volatility spillovers between them during 19912016. We further analyze structural breaks of market dependences and consider the extent of their influence on such relationships. Our vine-copula results show that the dependences between the three paired markets, WTI-US, WTI-China and US-China, vary dynamically across the six identified structural break periods. In particular, the dependence between WTI-US is stronger and more volatile than that between WTI-China during most of the periods. The dependence between US-China remains at a lower level in the earlier periods, but increases in the final period. Our VAR-BEKK-GARCH results demonstrate distinctive volatility spillovers across these periods, with varying directionality, in response to the structural changes. Overall, our results indicate that the oil market stimulates rapid and continual fluctuations in market dependences, which become manifest most acutely in the aftermath of the Financial Crisis of 200708, demonstrating the increasing interdependence between the oil and stock markets. Further, the growing influence of China on the dynamics of these relationships, in the period following the Great Recession, presents evidence that it begins to assume an increasingly important role in global economic recovery.  2018 Elsevier Inc.",Contagion/Spillover
31,0.02082032,"investment, cash, capital, cash flow, financing, firm, growth, cash holding, investment opportunity, financial constraint","cash holding, cash flow, investment opportunity, corporate investment, investment, capital expenditure, cash, capacity, financial constraint, financing","cash flow sensitivity, corporate investment, cash holding, investment opportunity, corporate cash, investament, capital expenditure, capital investment, cash flow, corporate cash holding","cash flow sensitivity, investment, cash, cash flow, financing, cash holding, capital, financial constraint, firm, corporate investment","investment, cash, capital, cash flow, financing, firm, growth, cash holding, investment opportunity, financial constraint",10.1016/j.jfineco.2016.03.011,Intangible capital and the investment-q relation,"The neoclassical theory of investment has mainly been tested with physical investment, but we show that it also helps explain intangible investment. At the firm level, Tobin's q explains physical and intangible investment roughly equally well, and it explains total investment even better. Compared with physical capital, intangible capital adjusts more slowly to changes in investment opportunities. The classic q theory performs better in firms and years with more intangible capital: Total and even physical investment are better explained by Tobin's q and are less sensitive to cash flow. At the macro level, Tobin's q explains intangible investment many times better than physical investment. We propose a simple, new Tobin's q proxy that accounts for intangible capital, and we show that it is a superior proxy for both physical and intangible investment opportunities.  2016",Corporate Investment
32,0.023400322,"fund, performance, mutual fund, manager, hedge fund, benchmark, style, fee, alpha, return","mutual fund, hedge fund, fund, fund manager, fund performance, etfs, equity mutual fund, mutual fund performance, skill, equity fund","fund family, equity mutual fund, mutual fund performance, performance persistence, fund return, fund performance, fund investor, mutual fund industry, fund size, mutual fund","fund family, fund, mutual fund, hedge fund, performance, manager, alpha, fund manager, style, skill","fund, performance, mutual fund, manager, hedge fund, benchmark, style, fee, alpha, return",10.1093/rfs/hhs100,Out of the dark: Hedge fund reporting biases and commercial databases,We examine the potential for selection bias in voluntarily reported hedge fund performance data. We construct a set of hedge fund returns that have never been reported to a commercial hedge fund database. These returns allow a direct comparison of performance between funds that choose to report to commercial databases and funds that do not. We find that funds that report their performance to commercial databases significantly outperform nonreporting funds. Our results suggest that the voluntarily reported performance in commercial databases suffers from a selection bias that may exaggerate the average skill of the universe of hedge fund managers.  2012 The Author.,Fund Performance
33,0.014029865,"quality, accounting, disclosure, standard, report, transparency, information asymmetry, adoption, information, accrual","disclosure, auditor, accounting, audit, quality, statement, transparency, report, tone, conservatism","readability, standards, tone, auditor, disclosure, sfas, voluntary disclosure, ifrs, financial report, audit","readability, disclosure, quality, accounting, transparency, audit, auditor, report, accrual, information asymmetry","quality, accounting, disclosure, standard, report, transparency, information asymmetry, adoption, information, accrual",10.1016/j.pacfin.2014.12.002,Accounting quality in the pre-/post-IFRS adoption periods and the impact on audit committee effectiveness - Evidence from Australia,"In this paper we examine whether accounting quality has improved following the adoption of International Financial Reporting Standards (IFRS), and investigate whether audit committees are more effective in promoting accounting quality under IFRS than previous Australian GAAP. We analyse two hundred companies listed on the ASX from 2003 to 2008 and employ univariate and multiple regression models to test developed hypotheses. Our results suggest that accounting quality is not significantly enhanced subsequent to the adoption of IFRS in Australia. In addition, we find that audit committees are more effective in maintaining accounting quality under IFRS than under previous Australian GAAP (AGAAP). The findings of our study help regulators by showing the impact of IFRS and audit committee characteristics on accounting quality.  2014 Elsevier B.V.",Disclosure
34,0.0193853,"finance, uncertainty, research, article, project, literature, development, theory, review, issue","uncertainty, finance, review, project, research, papers, epu, economics, entrepreneur, economic policy uncertainty","crowdfunding, epu, theme, uncertainty, scholar, review, finance, papers, capital budgeting, home bia","crowdfunding, uncertainty, finance, project, research, review, entrepreneur, epu, development, economic policy uncertainty","finance, uncertainty, research, article, project, literature, development, theory, review, issue",10.1016/j.pacfin.2017.04.005,Research in finance: A review of influential publications and a research agenda,"This article uses bibliographic mapping to identify the fifty most influential articles in the Tier 1 Finance journals since their inception, and to visualize the conceptual interrelations among them. Over the last 50 years, the field of finance has developed from a few publications on Asset Pricing into six distinct genealogies. We review each of these to ascertain their main contributions to research in finance, and to outline knowledge gaps and future research directions. We closely examine publications since 2010 to identify emerging research trends. The article sets an agenda for finance research in the 21st century.  2017",Financial Literature Analysis
